{
  "productCode": "GEN-ACC-TRAVEL-001",
  "regulatoryName": "中意乐游旅行意外伤害保险",
  "marketingName": "乐游旅行意外险",
  "productSummery": "旅行意外险，意外身故/伤残50万保额，含旅行医疗保障",
  "onlineClaimFlag": true,
  "insurerName": "中意人寿保险有限公司",
  "version": "2024版",
  "salesRegions": "全国（不含港澳台）",
  "effectiveDate": "2024-01-01",
  "expiryDate": null,
  "status": "生效",
  "primaryCategory": "意外保险",
  "primaryCategoryCode": "C",
  "secondaryCategory": "旅行意外",
  "secondaryCategoryCode": "C04",
  "racewayId": "C0401",
  "racewayName": "旅行意外",
  "salesUrl": "https://www.generalichina.com/products/leyou",
  "underwritingAge": "出生满28日-80周岁",
  "coveragePeriod": "1年",
  "waitingPeriod": "无等待期",
  "deductible": "意外医疗100元免赔",
  "productHeroImage": "https://example.com/images/travel_hero.jpg",
  "productLongImage": [],
  "productAttachment": [
    "中意乐游旅行意外伤害保险-条款.pdf",
    "中意乐游旅行意外伤害保险-产品说明书.pdf",
    "中意乐游旅行意外伤害保险-费率表.pdf"
  ],
  "clausesCode": ["GEN-ACC-TRAVEL-2024-001"],
  "productIntroduction": "中意乐游旅行意外伤害保险是一款旅行意外险产品，提供旅行意外身故/伤残保障、旅行医疗保障。",
  "productAdvantages": "1. 旅行保障：涵盖旅行期间意外风险\n2. 保障全面：意外身故/伤残+旅行医疗\n3. 保费低廉：一天保费几元起\n4. 投保便捷：线上投保，快速生效",
  "precautions": "1. 仅保障旅行期间意外\n2. 意外医疗需在二级及以上公立医院就医",
  "crowd": "经常出行旅游的人群",
  "generalComment": "作为旅行意外险产品，保费低廉，保障全面。",
  "tags": "旅行意外",
  "coverageArea": "全球（不含战乱地区）",
  "hospitalScope": "二级及以上公立医院",
  "claimScope": "旅行意外身故/伤残及医疗",
  "occupationScope": "不限职业",
  "hesitationPeriod": "无犹豫期",
  "policyEffectiveDate": "投保成功次日零时",
  "purchaseLimit": 10,
  "annualPremium": 88,
  "renewalWarranty": "不保证续保",
  "healthConditionNotice": "无需健康告知",
  "coverageDetails": [
    {
      "item_code": "ACCIDENTAL_DEATH_DISABILITY",
      "item_name": "旅行意外身故、伤残保险金",
      "description": "旅行期间因意外伤害导致身故或伤残",
      "details": {
        "limit": 500000,
        "payout_multiplier": 1.0
      }
    },
    {
      "item_code": "ACCIDENTAL_MEDICAL",
      "item_name": "旅行意外医疗保险金",
      "description": "旅行期间因意外伤害导致的医疗费用",
      "details": {
        "limit": 50000,
        "deductible": 100,
        "reimbursement_ratio": 1.0,
        "hospital_requirements": "二级及以上公立医院",
        "coverage_scope": "不限社保用药"
      }
    },
    {
      "item_code": "SPECIFIC_ACCIDENT",
      "item_name": "航空意外额外赔",
      "description": "旅行期间乘坐民航客机发生意外",
      "details": {
        "scenario": "民航客机意外",
        "limit": 1000000,
        "payout_multiplier": 2.0
      }
    }
  ],
  "valueAddedServices": [
    {
      "id": "TRAVEL_ASSISTANCE",
      "name": "旅行援助服务",
      "description": "提供全球旅行救援协调服务"
    }
  ]
}
