{
  "productCode": "GEN-ACC-CHILD-001",
  "regulatoryName": "中意乐成长儿童意外伤害保险",
  "marketingName": "乐成长儿童意外险",
  "productSummery": "儿童专属意外险，意外身故/伤残20万保额，含意外医疗2万",
  "onlineClaimFlag": true,
  "insurerName": "中意人寿保险有限公司",
  "version": "2024版",
  "salesRegions": "全国（不含港澳台）",
  "effectiveDate": "2024-01-01",
  "expiryDate": null,
  "status": "生效",
  "primaryCategory": "意外保险",
  "primaryCategoryCode": "C",
  "secondaryCategory": "儿童意外",
  "secondaryCategoryCode": "C03",
  "racewayId": "C0301",
  "racewayName": "儿童意外",
  "salesUrl": "https://www.generalichina.com/products/lechengzhang",
  "underwritingAge": "出生满28日-17周岁",
  "coveragePeriod": "1年",
  "waitingPeriod": "无等待期",
  "deductible": "意外医疗100元免赔",
  "productHeroImage": "https://example.com/images/child_accident_hero.jpg",
  "productLongImage": [],
  "productAttachment": [
    "中意乐成长儿童意外伤害保险-条款.pdf",
    "中意乐成长儿童意外伤害保险-产品说明书.pdf",
    "中意乐成长儿童意外伤害保险-费率表.pdf"
  ],
  "clausesCode": ["GEN-ACC-CHILD-2024-001"],
  "productIntroduction": "中意乐成长儿童意外伤害保险是一款儿童专属意外险产品，提供意外身故/伤残保障、意外医疗保障。",
  "productAdvantages": "1. 儿童专属：专为儿童设计\n2. 保障全面：意外身故/伤残+意外医疗\n3. 保费低廉：一年保费几十元\n4. 投保便捷：线上投保，快速生效",
  "precautions": "1. 意外医疗需在二级及以上公立医院就医\n2. 10岁以下儿童身故保额最高20万",
  "crowd": "出生满28日-17周岁儿童",
  "generalComment": "作为儿童专属意外险产品，保费低廉，保障全面。",
  "tags": "儿童专属,高性价比",
  "coverageArea": "中国大陆（不含港澳台）",
  "hospitalScope": "二级及以上公立医院",
  "claimScope": "不限社保用药",
  "occupationScope": "不限职业（儿童/学生）",
  "hesitationPeriod": "无犹豫期",
  "policyEffectiveDate": "投保成功次日零时",
  "purchaseLimit": 3,
  "annualPremium": 68,
  "renewalWarranty": "不保证续保",
  "healthConditionNotice": "无需健康告知",
  "coverageDetails": [
    {
      "item_code": "ACCIDENTAL_DEATH_DISABILITY",
      "item_name": "意外身故、伤残保险金",
      "description": "因意外伤害导致身故或伤残，按约定给付保险金",
      "details": {
        "limit": 200000,
        "payout_multiplier": 1.0
      }
    },
    {
      "item_code": "ACCIDENTAL_MEDICAL",
      "item_name": "意外医疗保险金",
      "description": "因意外伤害导致的医疗费用，按约定给付保险金",
      "details": {
        "limit": 20000,
        "deductible": 100,
        "reimbursement_ratio": 1.0,
        "hospital_requirements": "二级及以上公立医院",
        "coverage_scope": "不限社保用药"
      }
    }
  ],
  "valueAddedServices": []
}
